Writing a Tech Resume,"When you apply for technology jobs, your resume is your opportunity to stand out from the crowd. Emma Bostian shows you how to showcase your technology skills, framing them to impress recruiters and potential employers. Discover how to tailor the content and length to catch a hiring manager’s eye. Learn how to leverage minor design details like spacing, font choice, and color palette to differentiate your resume from the rest, without stepping too far out. Plus, learn how to create a professional online presence on the platforms tech recruiters use most: LinkedIn and GitHub.",Course,2022-01-19 03:26 UTC,N/A,false,N/A,
Figure Drawing: Tonal Rendering,"How can you make a good figure drawing into a great figure drawing? Give it drama with tonal rendering. This course—taught on the iPad Pro—provides you with step-by-step demonstrations that can help you enhance the dimensionality and drama of your figure drawings using tonal rendering techniques. Instructor Amy Wynne starts by demonstrating how to create a five-part tonal gradient, and then shows how to apply this to simple 3D geometric shapes such as an egg, a cylinder, and a block; these shapes serve as the building blocks for constructing your figures. Amy also shows how to build the figure from the inside out—from structure to tonality—and apply silhouette and camouflage using inspiring master drawings as examples. Upon completing this course, you'll be equipped with a few simple techniques that can help you add beautiful lights and shadows to your figure sketches.",Course,2020-10-09 05:21 UTC,N/A,false,N/A,
Building Modern Projects with React,"Learn about some of the most important tools in the React ecosystem that help you simplify development and manage the complexities of state, side effects, structure, and styling. Instructor Shaun Wassell shows how to create a basic React project, and then explains how to add Redux, create thunks, use selectors, work with styled-components, perform testing, and more.",Course,2021-09-22 01:37 UTC,N/A,false,N/A,
Python Essential Training (2022),"Python is one of the most used dynamic languages for many large organizations, including Google, Yahoo, and IBM. Supported on all major operating systems, it comes pre-installed on Macs, and most Linux and Unix-based systems. In this course, instructor Ryan Mitchell gives you a comprehensive, accessible overview of Python 3. Ryan covers topics required for day-to-day programming in Python, including data types, data structures, operators and statements, control flow, loops, functions, classes, exception handling, and file management. If you’re just starting out on a computer programming journey and want to learn how to write Python programs to accomplish a wide variety of tasks, join Ryan in this course to start building a solid foundation to a Python career.",Course,2022-09-13 13:39 UTC,N/A,false,N/A,
Kubernetes: Microservices,"Build scalable and reliable microservices with Kubernetes. Kubernetes is a popular DevOps tool for managing containers at scale. Microservices allow developers to deploy individual app components, enabling continuous integration and increased fault tolerance. This course teaches how these technologies combine—culminating in a real-world microservices application hosted in a Kubernetes environment. Instructor Karthik Gaekwad describes the benefits of microservices and shows how they can be implemented inside the container-based architecture paradigm. Using an existing monolithic application, he breaks down its functionality, adds Kubernetes constructs, and deploys the new services into a Kubernetes environment with Minikube. Finally, Karthik introduces tools such as Helm and Jaeger, which are used along with Kubernetes to build more resilient microservices.",Course,2020-10-27 07:49 UTC,N/A,false,N/A,
Learning Kubernetes (2018),"Kubernetes is the world's most popular open-source container orchestration engine. It offers the ability to schedule and manage containers—Docker or otherwise—at scale. This course introduces developers, DevOps engineers, and IT pros to Kubernetes. First, learn how to get a Kubernetes environment up and running on Mac or Windows using Minikube, and understand the components for Kubernetes. Next, deploy a sample Kubernetes application and manage it with the Kubernetes dashboard. Instructor Karthik Gaekwad also shows how to deploy a more complicated application with a database and APIs. Then learn how to run jobs and cron jobs. Finally, explore more advanced topics, including production deployments, namespaces, monitoring and logging, and authentication and authorization.",Course,2021-09-07 07:42 UTC,N/A,false,N/A,
Python Essential Training (2018),"Due to its power and simplicity, Python has become the scripting language of choice for many large organizations, including Google, Yahoo, and IBM. A thorough understanding of Python 3, the latest version, will help you write more efficient and effective scripts. In this course, Bill Weinman demonstrates how to use Python 3 to create well-designed scripts and maintain existing projects. This course covers the basics of the language syntax and usage, as well as advanced features such as objects, generators, and exceptions. Learn how types and values are related to objects; how to use control statements, loops, and functions; and how to work with generators and decorators. Bill also introduces the Python module system and shows examples of Python scripting at work in a real-world application.",Course,2020-10-22 03:32 UTC,N/A,false,N/A,
Scrum: The Basics,"If you've spent any time in the project management world, you've likely heard of scrum—the popular framework for managing complex processes. If this mysterious-sounding framework has piqued your interest, this course can help provide you with a basic understanding of what scrum is and how you can start implementing it at work. Follow scrum expert Kelley O'Connell as she walks through why scrum has taken the business world by storm, and how it asks you to organize your team and work. Plus, she explains how to manage your projects and measure how they're faring, and set manageable improvement goals.",Course,2021-04-05 13:49 UTC,N/A,false,N/A,
